<?xml version="1.0" encoding="UTF-8"?>
<NationalParks xmlns:xsi="http://www.w3.org/2001/XMLSchema-instance" xsi:schemaLocation="NationalParks.xsd">
  
  <NationalPark Rating="4.9">
    <Name>Grand Canyon</Name>
    <Phone>928-638-7496</Phone>
    <Phone>888-297-2757</Phone>
    <Phone>866-499-2574</Phone>
    <Address NearestAirport="FlagStaff">
      <Number>8</Number>
      <Street>S Entrance Road</Street>
      <City>Grand Canyon</City>
      <State>AZ</State>
      <Zip>86023</Zip>
    </Address>
  </NationalPark>

  <NationalPark Rating="4.8">
    <Name>Yellowstone</Name>
    <Phone>307-344-7381</Phone>
    <Phone>307-344-2109</Phone>
    <Address NearestAirport="Bozeman">
      <Number>1</Number>
      <Street>Grand Loop Road</Street>
      <City>Yellowstone</City>
      <State>WY</State>
      <Zip>82190</Zip>
    </Address>
  </NationalPark>

  <NationalPark Rating="4.7">
    <Name>Yosemite</Name>
    <Phone>209-372-0200</Phone>
    <Phone>209-372-0740</Phone>
    <Address NearestAirport="Oakland">
      <Number>5000</Number>
      <Street>Yosemite Valley Loop Road</Street>
      <City>Yosemite Valley</City>
      <State>CA</State>
      <Zip>95389</Zip>
    </Address>
  </NationalPark>

  <NationalPark Rating="4.6">
    <Name>Zion</Name>
    <Phone>435-772-3256</Phone>
    <Phone>435-772-0171</Phone>
    <Address NearestAirport="LasVegas">
      <Number>1</Number>
      <Street>Zion Canyon Scenic Drive</Street>
      <City>Springdale</City>
      <State>UT</State>
      <Zip>84767</Zip>
    </Address>
  </NationalPark>

  <NationalPark>
    <Name>Great Smoky Mountains</Name>
    <Phone>865-436-1200</Phone>
    <Address NearestAirport="Knoxville">
      <Number>107</Number>
      <Street>Newfound Gap Road</Street>
      <City>Gatlinburg</City>
      <State>TN</State>
      <Zip>37738</Zip>
    </Address>
  </NationalPark>

  <NationalPark Rating="4.5">
    <Name>Rocky Mountain</Name>
    <Phone>970-586-1206</Phone>
    <Phone>970-586-1319</Phone>
    <Address NearestAirport="Denver">
      <Number>1</Number>
      <Street>Trail Ridge Road</Street>
      <City>Estes Park</City>
      <State>CO</State>
      <Zip>80517</Zip>
    </Address>
  </NationalPark>

  <NationalPark Rating="4.4">
    <Name>Grand Teton</Name>
    <Phone>307-739-3300</Phone>
    <Address NearestAirport="Jackson">
      <Number>1</Number>
      <Street>Teton Park Road</Street>
      <City>Moose</City>
      <State>WY</State>
      <Zip>83012</Zip>
    </Address>
  </NationalPark>

  <NationalPark Rating="4.3">
    <Name>Acadia</Name>
    <Phone>207-288-3338</Phone>
    <Phone>207-288-4632</Phone>
    <Address NearestAirport="Boston">
      <Number>25</Number>
      <Street>Park Loop Road</Street>
      <City>Bar Harbor</City>
      <State>ME</State>
      <Zip>04609</Zip>
    </Address>
  </NationalPark>

  <NationalPark Rating="4.2">
    <Name>Glacier</Name>
    <Phone>406-888-7800</Phone>
    <Address NearestAirport="Kalispell">
      <Number>1</Number>
      <Street>Going-to-the-Sun Road</Street>
      <City>West Glacier</City>
      <State>MT</State>
      <Zip>59936</Zip>
    </Address>
  </NationalPark>

  <NationalPark Rating="4.1">
    <Name>Joshua Tree</Name>
    <Phone>760-367-5500</Phone>
    <Address NearestAirport="LosAngeles">
      <Number>6554</Number>
      <Street>Park Boulevard</Street>
      <City>Joshua Tree</City>
      <State>CA</State>
      <Zip>92252</Zip>
    </Address>
  </NationalPark>

  <NationalPark Rating="4.0">
    <Name>Bryce Canyon</Name>
    <Phone>435-834-5322</Phone>
    <Address NearestAirport="SaltLakeCity">
      <Number>1</Number>
      <Street>Highway 63</Street>
      <City>Bryce Canyon City</City>
      <State>UT</State>
      <Zip>84717</Zip>
    </Address>
  </NationalPark>

</NationalParks>
