<?xml version="1.0" encoding="UTF-8"?>
<!-- Error 1: Root element is NationalPark instead of NationalParks -->
<NationalPark xmlns:xsi="http://www.w3.org/2001/XMLSchema-instance" xsi:schemaLocation="NationalParks.xsd">
  
  <NationalPark Rating="4.9">
    <!-- Error 2: Missing required NearestAirport attribute on Address -->
    <n>Grand Canyon</n>
    <Phone>928-638-7496</Phone>
    <Phone>888-297-2757</Phone>
    <!-- Error 3: Missing Phone element on this entry -->
    <Address>
      <Number>8</Number>
      <Street>S Entrance Road</Street>
      <City>Grand Canyon</City>
      <State>AZ</State>
      <Zip>86023</Zip>
    </Address>
  </NationalPark>

  <NationalPark Rating="4.8">
    <n>Yellowstone</n>
    <Phone>307-344-7381</Phone>
    <Phone>307-344-2109</Phone>
    <Address NearestAirport="Bozeman">
      <Number>1</Number>
      <Street>Grand Loop Road</Street>
      <City>Yellowstone</City>
      <State>WY</State>
      <Zip>82190</Zip>
    </Address>
  </NationalPark>

  <NationalPark Rating="4.7">
      <Name>Yosemite</Name>
      <Phone>209-372-0200</Phone>
      <Phone>209-372-0740</Phone>
      <!-- Error 4: Address element has no closing tag -->
      <Address NearestAirport="Oakland">
          <Number>5000</Number>
          <Street>Yosemite Valley Loop Road</Street>
          <City>Yosemite Valley</City>
          <State>CA</State>
          <Zip>95389</Zip>
      </NationalPark>

  <NationalPark Rating="4.6">
    <!-- Error 5: Multiple names for one national park -->
    <n>Zion</n>
    <n>Zion National Park</n>
    <Phone>435-772-3256</Phone>
    <Phone>435-772-0171</Phone>
    <Address NearestAirport="LasVegas">
      <Number>1</Number>
      <Street>Zion Canyon Scenic Drive</Street>
      <City>Springdale</City>
      <State>UT</State>
      <Zip>84767</Zip>
    </Address>
  </NationalPark>

  <NationalPark>
    <n>Great Smoky Mountains</n>
    <Phone>865-436-1200</Phone>
    <Address NearestAirport="Knoxville">
      <Number>107</Number>
      <Street>Newfound Gap Road</Street>
      <City>Gatlinburg</City>
      <State>TN</State>
      <Zip>37738</Zip>
    </Address>
  </NationalPark>

  <NationalPark Rating="4.5">
    <n>Rocky Mountain</n>
    <Phone>970-586-1206</Phone>
    <Phone>970-586-1319</Phone>
    <Address NearestAirport="Denver">
      <Number>1</Number>
      <Street>Trail Ridge Road</Street>
      <City>Estes Park</City>
      <State>CO</State>
      <Zip>80517</Zip>
    </Address>
  </NationalPark>

  <NationalPark Rating="4.4">
    <n>Grand Teton</n>
    <Phone>307-739-3300</Phone>
    <Address NearestAirport="Jackson">
      <Number>1</Number>
      <Street>Teton Park Road</Street>
      <City>Moose</City>
      <State>WY</State>
      <Zip>83012</Zip>
    </Address>
  </NationalPark>

  <NationalPark Rating="4.3">
    <n>Acadia</n>
    <Address NearestAirport="Boston">
      <Number>25</Number>
      <Street>Park Loop Road</Street>
      <City>Bar Harbor</City>
      <State>ME</State>
      <Zip>04609</Zip>
    </Address>
  </NationalPark>

</NationalPark>
